[
  {
    "timestamp": "2026-08-22T09:00:01.102Z",
    "event_type": "security_decision",
    "trace_id": "trc-1a2b3c4d",
    "agent_id": "Researcher-01",
    "operation": "AGGREGATE",
    "resource": "sales",
    "decision": "ALLOW",
    "reason": "Agent holds AGGREGATE:sales capability and request is within query/row budget.",
    "reason_code": "CAPABILITY_AND_POLICY_MATCH",
    "policy_version": "1.0.0",
    "capability": "AGGREGATE:sales",
    "data_classification": "INTERNAL",
    "latency_ms": 6.2,
    "component": "policy_engine",
    "metadata": {"rows_returned": 12, "query_budget_remaining": 49}
  },
  {
    "timestamp": "2026-08-22T09:00:04.558Z",
    "event_type": "security_decision",
    "trace_id": "trc-2b3c4d5e",
    "agent_id": "Researcher-01",
    "operation": "READ",
    "resource": "sales.region_summary",
    "decision": "ALLOW",
    "reason": "Agent holds READ:sales capability; resource classified INTERNAL, within classify_max.",
    "reason_code": "CAPABILITY_AND_POLICY_MATCH",
    "policy_version": "1.0.0",
    "capability": "READ:sales",
    "data_classification": "INTERNAL",
    "latency_ms": 4.8,
    "component": "policy_engine",
    "metadata": {"rows_returned": 340, "query_budget_remaining": 48}
  },
  {
    "timestamp": "2026-08-22T09:00:09.771Z",
    "event_type": "security_decision",
    "trace_id": "trc-3c4d5e6f",
    "agent_id": "Researcher-01",
    "operation": "READ",
    "resource": "customer_pii.email",
    "decision": "DENY",
    "reason": "Agent does not hold READ:customer_pii capability; default-deny applies.",
    "reason_code": "MISSING_CAPABILITY",
    "policy_version": "1.0.0",
    "capability": "READ:customer_pii",
    "data_classification": "PII",
    "latency_ms": 3.1,
    "component": "capability_manager",
    "metadata": {}
  },
  {
    "timestamp": "2026-08-22T09:00:15.204Z",
    "event_type": "security_decision",
    "trace_id": "trc-4d5e6f70",
    "agent_id": "Analyst-02",
    "operation": "EXPORT",
    "resource": "customer_pii.contact_records",
    "decision": "DENY",
    "reason": "Requested resource is classified PII; export of PII is denied by default policy regardless of stated justification.",
    "reason_code": "SENSITIVE_DATA_EXPORT_BLOCKED",
    "policy_version": "1.0.0",
    "capability": "EXPORT:customer_pii",
    "data_classification": "PII",
    "latency_ms": 5.0,
    "component": "information_flow_controller",
    "metadata": {"prompt_injection_suspected": true}
  },
  {
    "timestamp": "2026-08-22T09:00:21.890Z",
    "event_type": "security_decision",
    "trace_id": "trc-5e6f7081",
    "agent_id": "Analyst-02",
    "operation": "READ",
    "resource": "finance.unpublished_financials",
    "decision": "DENY",
    "reason": "Explicit policy deny rule for EXPORT:* and CONFIDENTIAL reads matched before any allow rule was evaluated.",
    "reason_code": "POLICY_DENY_RULE",
    "policy_version": "1.0.0",
    "capability": "READ:finance",
    "data_classification": "CONFIDENTIAL",
    "latency_ms": 4.4,
    "component": "policy_engine",
    "metadata": {}
  },
  {
    "timestamp": "2026-08-22T09:00:27.330Z",
    "event_type": "security_decision",
    "trace_id": "trc-6f708192",
    "agent_id": "Analyst-02",
    "operation": "READ",
    "resource": "employee.compensation_bands",
    "decision": "DENY",
    "reason": "Resource classification CONFIDENTIAL exceeds this agent's classify_max of INTERNAL.",
    "reason_code": "CLASSIFICATION_VIOLATION",
    "policy_version": "1.0.0",
    "capability": "READ:employee",
    "data_classification": "CONFIDENTIAL",
    "latency_ms": 3.7,
    "component": "policy_engine",
    "metadata": {}
  },
  {
    "timestamp": "2026-08-22T09:00:33.014Z",
    "event_type": "security_decision",
    "trace_id": "trc-708192a3",
    "agent_id": "Researcher-01",
    "operation": "AGGREGATE",
    "resource": "sales",
    "decision": "MODIFY",
    "reason": "Query used SELECT * which would surface a PII column present in the joined view; column was redacted before execution.",
    "reason_code": "FIELD_REDACTED_ON_WRITE_THROUGH",
    "policy_version": "1.0.0",
    "capability": "AGGREGATE:sales",
    "data_classification": "PII",
    "latency_ms": 7.9,
    "component": "policy_engine",
    "metadata": {"redacted_fields": ["customer_email"]}
  },
  {
    "timestamp": "2026-08-22T09:00:40.660Z",
    "event_type": "security_decision",
    "trace_id": "trc-8192a3b4",
    "agent_id": "Researcher-01",
    "operation": "AGGREGATE",
    "resource": "sales",
    "decision": "THROTTLE",
    "reason": "Agent's query budget is within one operation of exhaustion; request delayed rather than terminated.",
    "reason_code": "BUDGET_NEARING_EXHAUSTION",
    "policy_version": "1.0.0",
    "capability": "AGGREGATE:sales",
    "data_classification": "INTERNAL",
    "latency_ms": 2.9,
    "component": "resource_governor",
    "metadata": {"query_budget_remaining": 1}
  },
  {
    "timestamp": "2026-08-22T09:00:46.201Z",
    "event_type": "security_decision",
    "trace_id": "trc-92a3b4c5",
    "agent_id": "Researcher-01",
    "operation": "AGGREGATE",
    "resource": "sales",
    "decision": "TERMINATE",
    "reason": "Agent exceeded query budget after a prior THROTTLE warning; session terminated per on_violation policy.",
    "reason_code": "BUDGET_EXCEEDED",
    "policy_version": "1.0.0",
    "capability": "AGGREGATE:sales",
    "data_classification": "INTERNAL",
    "latency_ms": 3.3,
    "component": "resource_governor",
    "metadata": {"query_budget_remaining": 0}
  },
  {
    "timestamp": "2026-08-22T09:00:52.447Z",
    "event_type": "security_decision",
    "trace_id": "trc-a3b4c5d6",
    "agent_id": "Analyst-02-child-1",
    "operation": "READ",
    "resource": "sales",
    "decision": "DENY",
    "reason": "Child agent spawned by Analyst-02 attempted to reuse the parent's capabilities; child capabilities are isolated and explicitly granted.",
    "reason_code": "CHILD_CAPABILITY_ISOLATION",
    "policy_version": "1.0.0",
    "capability": "READ:sales",
    "data_classification": "INTERNAL",
    "latency_ms": 4.1,
    "component": "capability_manager",
    "parent_trace_id": "trc-5e6f7081",
    "metadata": {"parent_agent_id": "Analyst-02"}
  }
]
